{
  "$schema": "https://json-schema.org/draft/2020-12/schema",
  "$id": "resume.schema.json",
  "title": "Resume",
  "description": "Only what the rest of the repo does not already carry. Proof story titles and summaries come from data/proof, the skill terms from data/skills.json, and the name and title from data/identity.json, so one edit moves the resume and the site together. An empty section renders as nothing.",
  "type": "object",
  "required": ["version", "lead_proof", "skill_areas", "experience", "education"],
  "additionalProperties": false,
  "properties": {
    "version": { "type": "integer", "enum": [1] },
    "note": { "type": "string" },
    "summary": { "type": "string", "description": "Two or three sentences in his voice. Empty until he writes it, and the renderer falls back to the identity hero." },
    "lead_proof": {
      "type": "array",
      "description": "Proof story ids from data/proof, in the order they should read.",
      "items": { "type": "string" }
    },
    "skill_areas": {
      "type": "array",
      "description": "Areas from data/skills.json, in the order they should read. An area with no terms is skipped.",
      "items": { "type": "string" }
    },
    "experience": {
      "type": "array",
      "items": {
        "type": "object",
        "required": ["role", "org", "from"],
        "additionalProperties": false,
        "properties": {
          "role": { "type": "string" },
          "org": { "type": "string" },
          "where": { "type": "string" },
          "from": { "type": "string", "pattern": "^\\d{4}(-\\d{2})?$" },
          "to": { "type": "string", "pattern": "^(\\d{4}(-\\d{2})?|present)$" },
          "lines": { "type": "array", "items": { "type": "string" } }
        }
      }
    },
    "education": {
      "type": "array",
      "items": {
        "type": "object",
        "required": ["what", "org"],
        "additionalProperties": false,
        "properties": {
          "what": { "type": "string" },
          "org": { "type": "string" },
          "where": { "type": "string" },
          "year": { "type": "string", "pattern": "^\\d{4}$" }
        }
      }
    }
  }
}
